Heading,ParaCan robots tackle late-life loneliness?,"In this era, everyone is busy in his life. No one spares time for someone. so robots tackle life loneliness? We have no time to stand and stare. This causes loneliness. Loneliness is due to fast-moving life and hurry and worry. In the 21st century, everyone is spending most of their time earning money. They are day-by-day transforming into money-earning machines. Due to his perception, we are losing our relations as we can’t give enough time to our families. They are busy earning their livelihood. They never get satisfies and always want more. Everyone is in a race of earning and then sends his children far away from himself to make them well settled in order to maintain their status. But one faces the consequences of this kind of lifestyle in his old age. People usually don’t spend time with their children when their children are in their childhood but they yearn for the company of their children in their old age. They feel lonely but have none to talk with. They are still attached to people, places, belongings, and memorable events from the past, although they understand that life cannot continue the same way as earlier, and this may easily result in feelings of loneliness and social isolation. As they become older, they need to be attended to in order to meet their daily needs. Robots can indeed serve the purpose but they can aid only mechanical care. They are just emotionless, feeling fewer entities. Robots aren’t creative. They can work only according to a pre-programmed system and till now no such software has been created that can transfer human feelings into robots. This is the major loophole of using robots to tackle late-life loneliness. They can undoubtedly serve their masters but their masters can’t share their feelings with them as they are incapable to understand or react to them. They can’t change their activity according to the occasion. They can provide anything except emotional satisfaction and without emotional gratification, loneliness can’t be tackled. A master can be attached to his robot but that attachment is only due to their service. They can’t share their thoughts with them. In this era, we are rendered lonely and in late- life feel the need for a companion with whom we can talk. We feel a need for someone who can listen to us, react, and advise us to tackle our day-to-day life problems. But we can’t find one. We have, undoubtedly, achieved great progress in terms of technology but we can never fill the void in the heart of a person struggling with his late-life loneliness with our advancements. We are in a kind of mental trance in which we experience fame, progress, wealth, etc. but when we gain our consciousness, we find ourselves lonely in this world. Relations in life are actual wealth in a person’s life. We can never enjoy such a bond with a robot. It will follow our commands, take our appropriate care but can’t react to our emotions. It can’t console us. When a man lives in loneliness for a long time, it eats up his conscience and transforms him into a machine. Robots can never become our friends, crack jokes, weep our tears, or establish an emotional connection with us. They can’t understand our feelings. Many people go into depression. Depression or the occurrence of depressive symptoms is a prominent condition amongst older people, with a significant impact on their well-being and quality of life. They remain sick and loneliness directly impacts longevity. Lonely people often think that they are no longer needed in this world and thus they want to die. It impacts their mental, psychological, social, and physical health. Robots prove to be useless in these matters. They can provide motivation, only if they have the software to do so but can’t, themselves, react to such a situation. They don’t know about anger, happiness, or sadness. They don’t themselves bring food when their master is hungry until commanded to do so. They can’t even offer a glass of water themselves. A man living without relations and without fellow feeling no longer remains a human being. He becomes none less than a machine as, due to his loneliness, he becomes mentally ill and goes into a condition like trauma where he no longer enjoys nature’s blessings, becomes happy or sad as he loses the ability to react and hence can’t act. It’s a dangerous situation. We face a plethora of challenges in assisted living facilities such as not being addressed to emotional needs, being neglected, and forcing a withdrawal from social activities. Relations in life, interaction with fellow beings, sharing of joy and happiness, and fellow feeling make a man from mere a ‘being’ to a ‘social being’ and finally a human being."
Embedding care robots into society and practice: Socio-technical considerations,"Do senior citizens love machines ?, You should look at them when they watch TV when they love to play video games on a smartphone. So, If we give them a human-like structure with the ability of a smartphone to make these people happy then it would be quite a monstrous feat."
Management challenges for future digitalization of healthcare services,"They demand a streamlined patient experience so they can “self-service” to resolve most questions, issues, or concerns (e.g., downloading an immunization record, booking an appointment, paying their bills, or checking their account/insurance status) whenever, wherever, and however is most convenient for them."
Are we any closer to preventing a nuclear holocaust?,"One thought always comes to my mind…What if we lived without that dander hanging over our heads?And you all know what is that danger is. For more than 70 years the world has faced the very real threat of nuclear war.Nuclear war is a real and growing threat. The United States and Russia have left critical agreements and treaties, while actively planning to add new types of weapons to their arsenals.Meanwhile, US nuclear policy remains rooted in the Cold War, increasing the risk that nuclear weapons could be used again.It doesn’t have to be this way. With the right policy changes and a commitment to diplomacy, the United States can be a leader in reducing the nuclear threat and we can also help them. But the question arises is what are the activities are being done for the prevention of nuclear holocaust?And they are :"
Will technology eliminate the need for animal testing in drug development?,These alternatives can help in bringing down animal experimentation to a large extent. If science can progress without harming animals then we should go for it rather than putting them through excruciating pain. We must protect the animals as much as we can or else we would soon be living in a world without them. 
Will we ever understand the nature of consciousness?,"As it seems, researchers continue to study this unknown part of our mind and once we are able to fund and recover from the global pandemic, we will be able to answer one of psychology’s most difficult questions."
Will we ever colonize outer space?,"In order to transport the equipments on the regular basis, a large amount of fuel Is required, and other factors as well and Built the propellor depo for rocket landing building various infrastructure for the city one by one will create a way forward for idea of Colonizing at outer space."
What is the chance Homo sapiens will survive for the next 500 years?,
Why does your business need a chatbot?,"Now, when you found out why Mr. Sakamoto is happy and his business is growing in this competitive industry then, do you still have a question in mind that why does your business need a chatbot?"
How you lead a project or a team without any technical expertise?,"So, the answer to the question, which we came across in the first paragraph, is yes and no. Depending upon the position in the hierarchy (yes for a front-line manager and no for a CXO) and the type of the leader you are, the level of technical expertise needed varies. Though as stated earlier by Robert Katz, the CXO’s need to have the least amount of technical expertise, the CXO should know how the technology functions or what are the applications. What processes are to be followed to build the technology.  He or she should now what is to be done rather than how it is to be done, (#itsnothowitswhat). Otherwise, even though the company might be sitting on a gold mine but If the leader isn’t aware of that or isn’t learned enough to know what to do with it, no company can succeed even with having all the resources at their disposal. Leaders command respect and don’t demand it and that’s possible when they give value to their front-line employees, seek timely advice from the technical experts, and put the resources to the best of its uses. Otherwise, you will be surrounded by technical experts like dilberts. (#dilbert)"
Can You Be Great Leader Without Technical Expertise,"So, be a leader, not a boss which makes your life much better, as they’re a saying that “ A good objective of leadership is to help those who are doing poorly to do well and to help those who are doing well to do even better.”"
How does artificial intelligence affect the environment,"AI can automate the analysis of images of power plants to get regular updates on emissions. It also introduces new ways to measure a plant’s impact, by crunching numbers of nearby infrastructure and electricity use. That’s beneficial for gas-powered plants that don’t have the easy-to-measure plumes that coal-powered plants have."
How to Overcome Your Fear of Making Mistakes,"On its own, being afraid of making mistakes doesn’t make you more or less likely to make good decisions. If you worry excessively in a way that focuses only on how bad the experience of stress and uncertainty feels, you might make do or say the wrong things. However, if you understand how anxiety works at a cognitive level, you can use it to motivate careful but bold and well-reasoned choices."
Is Perfection the Greatest enemy of Productivity?,Productivity is far from being your enemy. The greatest enemy will be your expectations which lead to dissatisfaction. It will play a major role in crafting your idea of Perfection in every day.
Global financial crisis 2008 causes/effects and its solution,"CDOs and CDSs were not regulated during that time by the Federal Reserve and thus this whole situation ultimately led to credit crunch (became very difficult to get loans) and the whole economy of the US underwent a crisis that led to a global impact all around the world. Unemployment increased manifold and many new businesses had to shut down. Global trades all around the world also saw a crisis and finally, Global Recession hit the World."
Gender diversity and Equality in the tech industry, 
How to overcome your fear of making mistakes?,
How Small Business can survive the Coronavirus Crisis,"As Warren Buffet quotes, “You only have to do a few things right in your life so long as you don’t do too many things wrong.” this is the right time to do the right thing and over time businesses will ripe its benefits. "
Impacts of COVID 19 on Food products,"The state has recently announced a stimulus package of INR 5000 crore for nearly 50 lakh vendors, acknowledging the grave impact of their loss of livelihood. The intended relief for vendors will be a credit loan that will provide an initial working capital of INR 10,000 for all vendors, but this is not sufficient. Instead of credit, the government should think of converting it into direct income benefit, a cash grant, as livelihood support to start the income activity regularly. The vendors need income support to be able to restart work, and if they are not able to do so, how will they return the loan. In the face of the ever-changing crisis, vendor organizations have to step forward and advocate for vendors to be provided the resources they need to be able to resume their livelihoods. To this end, vendors organizations could consider the following for an advocacy agenda:"
Impacts of COVID 19 on Vegetable Vendors,"Finally, some fresh vegetable sellers may have shuttered for a period of time early in the epidemic, only to reopen recently. Alternatively, vendors may have launched soon after the in-person checks were completed, but still within the June-July 2020 endpoint timeframe. This is a drawback of the method; in order to offer the most reliable COVID-19 pandemic monitoring data, data must be collected in a short period of time."
Impact of COVID-19 pandemic on Tourism & Aviation industries,"Aviation and Tourism industries have the curse of being a luxury expense and thus, as the Coronavirus pandemic spread, the entire industry jolted to a halt. They are one of the hardest-hit sectors and have to adapt to a new normal wherein the revenue levels are unlikely to match to pre-COVID levels and margins have also reduced. However, in with a bleak future, this industry is here to stay because people have to travel, and eventually they will vacation as well. Coronavirus has become a “survival of the fittest” test for this industry and the stakeholders will come out of this disaster with strong business processes."
Impact of COVID-19 pandemic on sports events around the world.,
Changing landscape and emerging trends in the Indian IT/ITeS Industry.,"The COVID 19 pandemic has restructured our social fabric in a way that is unlikely to change anytime soon. The areas that we’ve discussed are likely to become the flagbearers of the digital revolution of the decade. An upward mobilization with regards to massive scale movement of industries online seems pertinent today being led by these domains in the IT industry. An unfortunate consequence of it is that a majority of the MSMEs may soon cease to exist, having been replaced by some of the other alternatives that we’ve discussed. It seems to be a never-ending circle where the ones who are making a profit out of this situation will continue to do so, while the others will be washed out from our collective memory."
"Online gaming: Adolescent online gaming effects demotivated, depression, musculoskeletal, and psychosomatic symptoms.","The cost: benefit value of prevention versus treatment of addiction disorders has been known for many years. It is important and beneficial to make use of several types of strategies in combating gaming addictiveness or disorder. Effective strategies include: educating gamers about gaming behaviors and consequences on their mental health; treatment geared towards helping the gamer to control his/her urge for video games, recognizing and dealing with disturbing thoughts and learning how to cope without video games; intrapersonal and interpersonal counseling to help gamers to explore their identity, build self-esteem, and enhance their emotional intelligence outside the fictional world of gaming and learning communication and assertiveness skills needed in social interactions; family involvement, including counseling and discussion family and other relationships; and developing new lifestyles. The latter is particularly important and to paraphrase the well-known mantra of Alcoholics Anonymous, it’s all about, people, places, and things. To prevent the persistent playing of video games, people need to explore new activities, set new goals and metrics of achievements beyond video game scores."
Human Rights Outlook,"To read more and for a video summary, click here"
How Voice search makes your business a successful business.,"A survey showed that, once a consumer makes a local voice search, their next most common action is to call the business (28%). Customers also are highly likely to visit company websites (27%), show up at the company’s location (19%), and do more research into that business or additional businesses (14% and 12%, respectively). So, in short, while voice services can allow a customer to complete many steps without human interaction, you shouldn’t see it as a total substitute. Many people are going to take further steps after the initial search, and they still will want to hear a human voice respond back once in a while. They are going to have more questions, and they’re willing to physically connect with you and what you offer. Don’t drop the ball in other areas, like making your site aesthetically pleasing and easy to navigate, having enough staff ready to chat, listing an accurate contact number, or keeping your store well-stocked. Voice search already is shifting the way customers engage with brands, but there’s still time for companies of any size to get involved with voice systems in ways that can benefit both the customer and the business’s bottom line. The next step is to find voice search solutions. However, as with other technologies, these are not necessarily one size fits all, meaning it’s critical to shop around and be specific about your goals. If you can customize and update your options in a scalable way, they’ll be even more effective for your business."
How the COVID-19 crisis is redefining jobs and services?,"To conclude, the companies should understand “Lives come first, but livelihood matters”. The pandemic will have some adverse effects on jobs and services, but this is not the end. The pandemic has brought many opportunities with him and if they are grabbed then the organizations would be in much better position even compared to pre-corvid situations. The companies need to understand the pandemic is not going to be forever. The last concluding sentence will be corona will bring changes but there will not be a revolution in jobs and services."
How to increase social media engagement for marketers?,"The fact remains that the share of mind and voice are key elements to being the dominant force in the world today. Social media marketing has leveraged all the elements and made its presence felt in every customer engagement. Finding unique ways to really stand out among the competition is key to a successful digital marketing strategy. Newer and more customized tools to feel the pulse of the market come up every single day, to meet the ever-changing needs of marketing heads. At the end of the day, ‘customer is indeed king’. And companies would do well to remember it! "
Impacts of COVID 19 on Streets Sides Food Stalls,"When Covid was an unknown word, these shopkeepers and vendors brought the taste to our mouth, gave us memories to live for, filled our bellies, and quenched our thirst when we needed them. It’s time to provide them with a hand now when they need it."
Coronavirus impact on energy markets,
COVID-19 Impact on Hospitality Industry,“Let’s be grateful to all the frontline workers saving the entire nation and also be thankful to all the various sectors of the hospitality industry who have come forward to help and serve the nation.”
Lessons from the past: Some key learnings relevant to the coronavirus crisis,"I don’t believe that every crisis is the same. Of course, there are a lot of unique things about the coronavirus pandemic that we had not expected to ever see. Even though these are different times, there are still lots of things we can apply from our past experiences. We cannot find a cure for the virus but we can find ways to maintain the economy, our mental peace, and prevent the spread of the virus. The past has a lot to offer if we ponder. We must learn to understand the mistakes of the past and better them in the future. Our past experiences with the different crises have taught us that fiscal stimuli work, maintaining employee morale is important and that social. Engagement is imperative. If we use these tools efficiently, we can ensure that people only have to fight the virus and not worry about the multitude of repercussions that come with it."
Estimating the impact of COVID-19 on the world of work,"The businesses will soon rise again, people will get back to their jobs, vendors will start getting profits and everything will fall into its places but now a megalithic competitive environment will rise which will grow till decades until nature again shows it’s color and we as a human abide with its outcomes, learning some new lessons and keeping this cycle of fall and growth running."
Estimating the impact of COVID-19 on the world of work,Amid of Coronavirus outbreak we can see the major economies are strengthening their authorities with their major concern
Travel and Tourism Outlook,"To read more and for a video summary, click here"
Gaming Disorder and Effects of Gaming on Health.,
What is the repercussion of the environment due to the COVID-19 pandemic situation?,Follow social distancing guidelines . Stay Safe .
Due to the COVID-19 the repercussion of the environment,"The crisis due to the global pandemic is likely to be more serious for developing economies compared to the global financial crisis of 2008. This is due to the fact that the global financial crisis leads to lower demand for exports from the developing economies by the developed nations which further lead to contraction of export-based industries and other sectors in the developing nations due to inter-sectoral backward and forward linkage effect, however, the burden of retrenchments in the formal sector was absorbed in the informal sector. In the present situation, the problem of vanishing informal sector is evident since informal sector workers are more vulnerable to the spread of the disease due to the absence of non-regulatory authority and out of direct government control. Moreover, lockdown lead to massive close down of this informal units, thus the informal sector in this present set up is vanishing due to which the shock absorption capacity of developing economy like India is becoming weaker. The global economy is drowning towards deep cycles of economic depression and the aftershocks seem to be long-lasting. The only way of this global shock seems to be international policy coordination in line with the needs of the domestic economies"
Impact of COVID-19 pandemic on office space and co-working industries.,"COVID 19 will have severe impacts on the office (mental) space of companies and people.  People’s thoughts, how they treat others, along with accepting defeat and rejection will be an important aspect of everyone’s lives. Moreover, we might also observe a shoot in the intensity and frequency of office people going to psychologists; because of repeated rejection and unfair treatment. However, we need to cope with this thing and realize that it is indeed very important for us to start preparing to expand our mental space and that this competition and comparison will not stay for long and should not affect our personal relations and life at any cost."
Contribution of handicrafts (Visual Arts & Literature) in the Indian economy,Some key facts of Indian handicrafts industry
How COVID-19 is impacting payment preferences?,A revolution will take place only when the below poverty population of India will start using the online mode of payment and will be literate enough to not get caught in any scam.
How will COVID-19 affect the world of work?,"The call for action is for more money, to work with manufacturers to create capacity and to organize purchasing so there is guaranteed access, especially for poorer countries with less resilient public health systems. The concept is to create a global security stockpile of supplies and equipment, an effort that needs:"
Lessons from the past: Some key learnings relevant to the coronavirus crisis,"Corona Virus has united all the humanity against a cause to defeat a virus, this virus has made the world a better place, there are no terror attacks, there are no rape cases, there are no murders, no loots. The Earth is all healing."
COVID-19: How have countries been responding?,"After military personnel tested positive for the disease, planned annual joint military exercises with US forces have been put on hold."
How Coronavirus Impact on the Hospitality Industry, 
How will COVID-19 affect the world of work?,"All in all, the global outbreak of COVID-19 has ushered in a slew of radical changes to how work is perceived in the grand scheme of things. 2020 will go down in history books as the year that shook the very fundamentals of the world of work!"
Coronavirus: Effect on the Hospitality Industry,"Really this is anyone’s guess. We don’t yet know how long it will take for the epidemic to peak and for us to be allowed out again, but one thing I am sure of is that we’ll all be desperate to meet up with friends over dinner or have a pint in the pub! With proper support from the government I think the hospitality industry stands a good chance of bouncing back quickly, but perhaps not in its former form. It is likely that we will see a kind of natural selection take place among restaurants, leaving space for innovative new entrants. The crisis has already forced several restaurants to innovate by developing new services and perhaps, if regulation allows, these will stick, becoming new models for restaurants in the future and offering them a more diverse and resilient set of revenue streams. Thus Coronavirus Effect on the Hospitality and other sectors."
Estimating the impact of COVID-19 on the world of work,"STAY SAFE, STAY TOGETHER AND DEVELOP YOUR COMPANY FURTHER!"
COVID-19: How have countries been responding?,"This is the time to be prudent and try to remain optimistic as is illuminated by Charlie Munger,-“I would ……when the worst typhoon that’s ever happened comes. We just want to get through typhoon and we’d rather come out it with a whole lot of liquidity. …”"
