Heading,ParaBig Data & Analytics to Help Voters Know Their Political Leaders,"Big Data Analytics could be used by rating agencies which could actually launch ratings for politicians and this could be used by the general public in determining how good the leader is. Once the ecosystem is in setup it could be sponsored by the leader itself wherein the party or the leader would want to rate the previous results and personality which if quantified could substantiate their claims in the current scenario. Obviously, the second model would have to be properly audited else it would lose out the credibility. Even the government led organizations could actually keep a track of the election manifestoes of the leaders and then keep a real-time track of the progress of the key developments relating to the subjects in the set agenda."
Digital Transformation in Oil and Gas, 
Data Analytics as a Tool to Reduce the Cost of Production in Oil & Gas,"Over the coming years, the industry will be defined by those who will take advantage of digital and analytics to evolve. Investing in these will help digital to deliver better efficiency and productivity, for the brighter future of the industry."
Are Initial Big Data Efforts Focused on Gaining Insights from Existing Sources of Internal Data in Retail Industry?,"With these new capabilities, managers can quickly respond to marketplace demands and address business challenges. Having real-time and granular visibility into store-level sell-through and inventory data enables optimized replenishment and merchandising practices, while supply chain transparency promotes lower-cost logistics. The solution can be positioned the company for competitive advantage by helping boost sales and lower operational costs."
Role of Big Data in Cyber Security: A Shotgun Against Rising Cyber Security Attacks?,
Role of Big Data in Healthcare,
"Data Driven Dashboards, Foundation and Application in Industry","As a rule of thumb, operational dashboards require data in real-time or near real-time, whereas executive/strategic dashboards require data refreshed on a less frequent basis."
Role of Big Data in Academia,"Like other sectors like healthcare, retail, capital market, energy and many more, academia sees the potential of big data. To harness this potential, academics face a threefold challenge: generate teams with varied expertise, work on very focused yet meaningful research problems, while taking ethical questions into account. Many such efforts are appearing in academia, and we are, hopefully, to expect a great breakthrough in the near future."
Statistical Methods for Sales Forecasting in Retail Industry,"Sales forecasting is a real-world problem in fashion retailing. From the perspective on applications and implementation, various issues are identified."
Behavior Based Chi-Square model to Detect Data-Exfiltration over the Network,"Fig. 2: Superimposed Chi-Square values of outgoing Bytes of live data (abnormal profile data) and Threshold_1, Threshold_2 and Threshold_3 of learned data (normal profile data) for user type 1, 2 and 3 respectively."
What is Data Exfiltration?,"The closer the capacity is to the rate at which the operation or transmission is executed, the more covert the transmission will be. Covertness is thus proportional to the difference between capacity and the actual rate used:"
Impacts of COVID 19 on Food products,"The state has recently announced a stimulus package of INR 5000 crore for nearly 50 lakh vendors, acknowledging the grave impact of their loss of livelihood. The intended relief for vendors will be a credit loan that will provide an initial working capital of INR 10,000 for all vendors, but this is not sufficient. Instead of credit, the government should think of converting it into direct income benefit, a cash grant, as livelihood support to start the income activity regularly. The vendors need income support to be able to restart work, and if they are not able to do so, how will they return the loan. In the face of the ever-changing crisis, vendor organizations have to step forward and advocate for vendors to be provided the resources they need to be able to resume their livelihoods. To this end, vendors organizations could consider the following for an advocacy agenda:"
