Heading,Para
How is Login Logout Time Tracking for Employees in Office done by AI?,"With the use of AI and Deep Learning technologies, we can automate some routines stuff with more functionality which humans need more resources to keep track thereby reducing time spent on manual data entry works rather companies can think of making their position high in the competitive world."
How does AI help to monitor Retail Shelf watches?,"By this system, if it is implemented in a supermarket, where we can use this application to predict the market price and demand and accordingly we can forecast the demand and take actions in prior and this system can also keep track of the expiry of each perishable products and alerts for them to change it accordingly at the correct time. If some new product is released in the market and that is with great demand, our system will try to analyze where it is placed in the store, If it is not present in the store our system will report to the sales manager to add these new products in the store at a much reachable and visible place for the buyers."
AI and its impact on the Fashion Industry,
How do deep learning models predict old and new drugs that are successfully treated in healthcare?,"Understanding exactly how data is ingested, analyzed, and returned to the end-user can have a big impact on expectations for accuracy and reliability, not to mention influencing any investments necessary to whip an organization’s data assets into shape. To efficiently and effectively choose between vendor products or hire the right data science staff to develop algorithms in-house, healthcare organizations should feel confident that they have a firm grasp on the different flavors of artificial intelligence and how they can apply to specific use cases. Deep learning is a good place to start.  This branch of artificial intelligence has very quickly become transformative for healthcare, offering the ability to analyze data with a speed and precision never seen before. Deep learning, also known as hierarchical learning or deep structured learning, is a type of machine learning that uses a layered algorithmic architecture to analyze data. In deep learning models, data is filtered through a cascade of multiple layers, with each successive layer using the output from the previous one to inform its results. Deep learning models can become more and more accurate as they process more data, essentially learning from previous results to refine their ability to make correlations and connections. Deep learning is loosely based on the way biological neurons connect to process information in the brains of animals.  Similar to the way electrical signals travel across the cells of living creates, each subsequent layer of nodes is activated when it receives stimuli from its neighboring neurons. In artificial neural networks (ANNs), the basis for deep learning models, each layer may be assigned a specific portion of a transformation task, and data might traverse the layers multiple times to refine and optimize the ultimate output.  These “hidden” layers serve to perform the mathematical translation tasks that turn raw input into meaningful output. With the crypto anchors and blockchain employed with the medicine for example each pill of medication will be printed with scannable details which contains the time of production, originality, etc, which can be printed in medicine using edible substances. Once the medicine is shipped all over the world we can scan the medicine with a scanner and find out whether the medicine is original or counterfeit with the blockchain details stored at the time of manufacturing. By using deep learning in medicines these neural networks will make sense of all the unrelated data and make them into understandable and scalable data so that can be used for making the medicine efficiency better by analyzing molecules of each component used in the medicine."
How artificial intelligence can boost your productivity level?,"So, what we have understood is AI has penetrated our day-to-day life. Now the question is how people can use it in the best possible way to extract value from it and boost their productivity even further? Here are some of my suggestions:"
How are genetic sequencing maps affected by deep learning and AI?,"Even though the use of AI and deep learning can solve many problems related to genomic data, the use is challenging and not cost-effective at all. It needs high-quality machines and skilled experts. But as it was said that – ” If it’s worth it then it’s nothing to worry about.” But if we succeed in applying the concept of deep learning and AI in genetics with cost-effectiveness it will create a history in the world of science and biology and it is possible that humans can reach new heights of genetics and the human genome."
How is AI used to solve traffic management?,"Traffic congestion prediction is getting more attention from the last few decades. With the development of infrastructure, every country is facing a traffic congestion problem. The development of artificial intelligence and the availability of big data have led researchers to apply different models in this field. Deep learning algorithms became more popular with time as they can assess a large data set. However, a wide range of machine learning algorithms is yet to be applied. Therefore, a vast opportunity for research in the field of traffic congestion prediction still prevails. The power of AI that propels a lot of the data analysis of these systems, is also what powers the navigation systems of ride-hailing as well as last-mile delivery operators. Deliveries or order fulfillment that had to be delayed in the past, can now be enhanced significantly as cities around Asia continue taking up such intelligent traffic systems."
Benefits of Big Data in Different fields,"According to statistics, digital transformation, technological advancements, and breakthroughs continue to be the primary drivers of the rising amount of big data.  Big data is already enormous, but it is anticipated to rise exponentially as new technologies emerge, such as more widespread IoT devices, drones, and wearables, and computing devices increase. Around Ninety percent of the world’s big data has been created in the previous two to three years. With the enormous bulk of raw data; businesses and industries require proper analysis of those unstructured data sources to draw more insights by effectively and efficiently converting them into useful information. Modernization coupled up with rapid industrialization has put much pressure on data culture and mining, hence paving the way to complex analytical tools to culture and introspect data thereby extracting out the essence out it, those recent advancements in deep learning are also helping businesses decipher this valuable trove of information. Big data and business analytics solutions have become mainstream technologies, and they, together with AI and automation, provide the foundation for the digital transformation process."
How Big Data Will Impact the Future of Business?,Big data analytics is the future of business
How Will AI Make Decisions In Tomorrow’s Wars?,We all can only make assumptions. None of us have seen the future.
Which one is better AI or big data?,"However, Big data and artificial intelligence are interdependent meaning they cannot exist without one another. If one is taken out of the picture, then another one cannot exist. Big Data and AI are two technologies of posterity which do not compete but complement each other."
How robots can help in e-learning platforms?,"But if we want to make e-learning portals the future of the education system, then we have to keep other things in mind. Learning is not just about academics. Building discipline, peer-to-peer relationships, teamwork, developing a strong sense of ethics, integrity, communication skills, and leadership skills are a part of the learning process. Hence, the e-learning portals can use robots or AI to implant this in the learning process to make it wholesome."
How does Big Data Help in Finance and the Growth of Large Firms?,
"Future of Work: Robot, AI and Automation","Even though a technological revolution can lead to wiping out of a mass number of jobs it will create more new job opportunities. Some jobs and sectors are going to witness historical growth in the future. Recent studies show that analytical thinking, creativity, and flexibility are among the top skills needed over the next five years, while data and artificial intelligence, content creation, and cloud computing are the top emerging professions. It will also increase the efficiency of employees thus creating more profit. For example, email marketing is now one of the most efficient ways of marketing where the employer can automatically analyze the effectiveness of campaigns. A technological revolution can also create a revolution in manufacturing which is the “quintessential escalator for developing economies”. Like any other new technology, artificial intelligence and robotics will initially be met with skepticism but eventually being embraced. Technological or robotics revolution will be a milestone in human history which will lead to the creation of more opportunities and a better future for millions."
How AI will help the Defense Power of a country?,"However, there is a concern that applies to all sectors using AI: Will AI replace humans? Will it rule us? The answer is yes if we use too much AI. The same applies in the defense sector also. The applications that have been discussed here act as force multipliers as long as humans control them. AI should never replace soldiers, but perform tasks that are too risky or impossible for humans. AI should not be allowed to become too intelligent nor they should be allowed to operate independently. Machine learning should be confined only to familiarize with battlefield situations, not to think ahead of us and act arbitrarily. Before such a device fires a bullet on its own, a human must be there to see that it happens according to his will. Another concern is hacking. What if the enemy hacks these devices? Such concerns must be addressed by adding multiple layers of encryption or limiting the amount of communication possible. Take, for example, a regular ‘nonsmart’ washing machine. We cannot communicate with it in any other way other than pressing its buttons. Nor can it do anything else other than washing clothes. This could be done with all the unmanned vehicles. Communication must be restricted to the user and the machine. The device should perform only its intended duty. If a nation learns to harness and balance the use of technology, then not only its defense sector but also all the other sectors will be stronger and ensure the nation’s holistic development."
Future of AI and Machine Roles in the Medical Sector,"Many would say that at the end of the day AI is just manmade creation, there will be some flaw in it, we can’t fully trust them, there can be any glitch in it, or what doctor can do AI will never be able to do. In the modern world with the existence of a pandemic situation, AI will be never able to take the place of a doctor but with the assistance of AI, a doctor will able to handle the situation more efficiently and with up gradation in modern technology, they will be well prepared of a situation like covid-19, hope it will never come in future. At last, AI will usher in a new era of mankind and exciting breakthroughs in the human world, since today AI and machine play a very important role in every human’s life, nowadays it is becoming as important as water for living."
AI in healthcare to Improve Patient Outcomes,"Considering the vast range of tasks that an AI can do, it is evident that it holds deep potential in improving patient outcomes to skyrocketing levels. Using sophisticated algorithms AI can bring a revolution in the healthcare sector. Even after facing challenges like whether the technology will be able to deliver the promises, ethical measures, training physicians to use it, standard regulations etc, the role of AI in transforming the clinical practices cannot be ignored. The biggest challenge is the integration of AI in daily practice. All of these can be overcome and within that period the technologies will mature making the system far more enhanced and effective."
What if the Creation is Taking Over the Creator?,
What Jobs Will Robots Take From Humans in The Future?,"There have been various reports in the past and current years which claim that a significant piece of the human labor force will be replaced via robots and machines in the years to come. With excessive innovative work being led in the field of computerized reasoning, many dread that a significant job crisis will unfurl since numerous positions are all the more precisely and productively performed with the use of machines. In countries like Japan, mainly computer programs and AI is used in the secondary and tertiary sectors. From cleaning the house to depositing money in banks, everything is done by AI. However, AI cannot replace humans in the future. Humans have several capabilities which, even after several technological advancements a machine would not be able to have. These capabilities include creative thinking and creative problem solving, and human connection. For example, when a child goes to a doctor to get an injection, a nurse always relaxes the child to not be afraid of the needle. A machine’s touch would not be able to soothe a child. Another example could be how humans tend to share things with each other and be open about it, a machine will not be able to do so since it is only programmed to things it has been told to do. Like computers, AI will not replace us but would however complement us to make daily work easier and less time-consuming. Without humans themselves, there is no future for AI."
Will Machine Replace The Human in the Future of Work?,
Will AI Replace Us or Work With Us?,"So, will machines be able to take over many of our jobs? The answer is a resounding yes. However, for every job that is taken over by robots, there will be an equal number of positions available for people to do. Some of these human vocations will be artistic in nature. Others will necessitate humans honing superhuman cognitive abilities. Humans and machines can form symbiotic relationships, assisting each other in doing what they do best. In the future, people and machines may be able to collaborate and work together towards a common goal for any business they work for. "
Will machine replace the human in the future of work?,
How humans and machines are evolving to work together?,                
How neural networks can be applied in various areas in the future?,"We can only hope that as we progress into the upcoming decades, the people who are in control of the decisions that these companies make will be for the betterment of society and civilization as a whole. And that our data will be for building systems that serve us, make us more productive, and instead of looking for ways to grab our attention, build products that can provide value and meaning to our lives."
How machine learning will affect your business?,"As the algorithm becomes increasingly more accurate, the unit economics of your business process become better and as machine learning becomes able to handle more cases, the expensive humans are only called in on the toughest, rarest situations. That means you use the best of both human and machine intelligence in tandem: leveraging the speed and reliability of computers for the easy judgments and the fluency and expertise of humans for the difficult ones. And if that sounds like smart business, it’s because it is."
Deep learning impact on areas of e-learning?,"Rezi: Now, as a disclaimer, I would never encourage you to turn your resume writing over to a bot. But Rezi is an awesome AI-based resume builder that includes templates to help you design a resume that is sure to check the boxes when it comes to applicant tracking systems. This is a great jumping-off point to kickstart a new resume.  Another great way to use this type of tool is to generate a new resume and compare it to your current resume to see how it stacks up, and identify some areas for improvement. AI is also a great place to focus your energy if you are looking to upskill in your career, or make your professional profile more competitive in the job market, especially when you consider that AI will have such far-reaching impacts across many industries.AI and machine learning are at the top of many lists of the most important skills in today’s job market. Jobs requesting AI or machine-learning skills are expected to increase by 71% in the next five years. If you’d like to expand your knowledge base in this arena, consider some of the great free online course offerings that focus on AI skills. If you are tech-savvy, it would be wise to dive deep and learn as much as you can about interacting in the AI space. If your skills lie elsewhere, it is important to recognize that AI will have a big impact, and to the extent of your abilities, you should try to understand the fundamentals of how it functions in different sectors. AI is definitely here to stay, whether we like it or not. Personally, I don’t think we have anything to be afraid of. The best way to move forward is to be aware of and adapt to the new technology around us, AI included. This article was updated on April 16, 2021, to reflect changes in HireVue’s assessment tools."
How to protect future data and its privacy?,"If you back up your files to the cloud, remember that even though you delete them on your computer or mobile device, they’re still stored in your cloud account. If you’re diligent about backing up your data and use a secure cloud storage service to do so, you’re headed in the right direction. That said, cloud backups, and any data backups really, create an added step when it comes to deleting old information. Don’t forget to delete files from your backup services in addition to those you remove (or overwrite) on your local devices. “If you back up your files to the cloud, remember that even though you delete them on your computer or mobile device, they’re still stored in your cloud account. To completely delete the file, you’ll also need to remove it from your backup cloud account,” says re/code. Twitter: @Recode"
"How Machines, AI, Automations, and Robo-human are Effective in Finance and Banking?",
How Robo Human will Impact the Future?,"In the future, AI is not going to replace humans, rather make jobs more humane. AI will disrupt millions of middle and entry-level jobs in the next few years but will also create millions of additional jobs and help to boost economies."
How AI will change the World?,"Machines are indeed going take away many of our jobs, but let me make you sleep peacefully tonight, the machines aren’t arriving until we’re retired.  "
Future of Work: How AI Has Entered the Workplace,
How machine learning used in finance and banking?,
How AI will impact the future of work?,
All you need to know about online marketing, 
Evolution of Advertising Industry, 
How Data Analytics can help your business respond to the impact of COVID-19?,"These techniques, tools, and models, can help businesses tackle this horrendous situation that is COVID-19."
COVID-19 Environmental impact for the future?,"It’s high time now that we take collective action and build a shared future for all creatures in the ecosystem in a greener way and with more nature-based solutions. Let us all pledge to flatten the curve of deforestation, habitat destruction, and climate disruption to prevent our Mother Earth from reaching ‘the point of no return’ and ‘dire catastrophe’.  Ideas like weeklong yearly lockdown can be cherished for developing sustainable solutions to ‘shift from the grey to green economy’. With collective efforts, we can definitely Bounce Back Greener from this pandemic. When nature itself, through this lockdown has shown a trailer of Green Living, so why not create a beautiful movie out of it?"
Environmental impact of the COVID-19 pandemic – Lesson for the Future, 
How Data Analytics and AI are used to halt the COVID-19 Pandemic?,"Above mentioned applications just show the tip of the iceberg and there is more to get into some of the other developments to watch for include the use of Image Recognition to identify covid based on x-ray images, the use of Deep Learning to predict the 3-D protein structure associated with COVID-19 and so on."
"What is the difference between Artificial Intelligence, Machine Learning, Statistics, and Data Mining?","            So, the difference between AI Machine Learning Statistics and Data Mining lies in their aims. But the approaches taken in all of these fields, help in one way or the other in fulfilling the aims of the other fields. This is the beauty of these fields!"
How Python became the first choice for Data Science.,"So next time you do analysis or work on any Data Science project, feel proud cause you are working with the most loved language of the world."
How Google fit measure heart and respiratory rates using a phone camera?,"Pixel underwent and completed initial clinical trials to validate the algorithm cloud work in a variety of different world conditions and that too with many people while developing the features. Since our heart rate relies on approximating blood flow from color changes in someone’s fingertip, it has to account for factors such as lighting, skin tone, age. Adding to be able to measure heart and respiratory rate soon Google Fit also displays user daily stats such as daily goals, weekly goals, heart points, workout, and also sleep monitor."
What is the future of mobile apps?,"Don’t try to fight the irresistible trend, see how you can surf the trend! Exposing yourself or trying to get a job in the field mentioned below will absolutely give you more opportunities as a mobile developer."
Impact of AI in health and medicine, 
What patients like and dislike about telemedicine?,"There are major challenges like better connectivity of the internet, without which the patients will not be able to have continuous interaction with the doctors. Technical glitches may hinder the consultation too. Moreover, emergency situations cannot be addressed beyond a limit through telemedicine."
How we forecast future technologies?,Advance in technology is usually nothing more than an accumulation of small advances not worth introducing individually to make a significant change in total technology. Forecast future technologies no matter how accurate – unless they eventually influence action.
